{"act":"request","body":{"dest":"Porto","n":3,"origin":"Lisboa","pi":3.5},"confidence":0.9,"expect":[{"check":{"field":"confidence","op":"gt","value":0.85},"id":"c1","weight":1}],"from":{"id":"planner-42"},"id":"msg:8502a75af4d53705","intent":"rota rápida","signature":{"alg":"ed25519","key":"parley-test:planner-42","sig":"ZScypD7OcSl/baJyy7mk3N5hiUMHz7+3Iy8VFVDNxFeC4iRRZGKwUaQlu4gIiRalyV/zTWlhMj68aZiBhW+AAw=="},"target":"route.plan","tenant":"acme","to":{"id":"dispatcher-7"},"ts":"2026-10-22T12:00:00Z","v":0}