[
  {
    "v": 0,
    "from": {
      "id": "planner-42"
    },
    "to": {
      "id": "dispatcher-7"
    },
    "ts": "2026-10-25T20:56:45Z",
    "act": "request",
    "target": "route.plan",
    "intent": "I need the fastest route, the user is in a hurry",
    "body": {
      "origin": "Lisboa",
      "dest": "Porto"
    },
    "deadline": "2026-10-22T15:00:00Z",
    "tenant": "acme",
    "expect": [
      {
        "check": {
          "field": "confidence",
          "op": "gt",
          "value": 0.85
        },
        "weight": 1.0,
        "id": "c1"
      },
      {
        "check": {
          "field": "route.eta_min",
          "op": "lte",
          "value": 150
        },
        "weight": 1.0,
        "id": "c2"
      },
      {
        "nl": "Route must avoid roads with announced roadworks in the next 24h",
        "weight": 0.9,
        "id": "c3"
      }
    ],
    "fallback": {
      "to": {
        "id": "dispatcher-backup"
      }
    },
    "id": "msg:6ea1857e9ed5d770",
    "signature": {
      "alg": "ed25519",
      "key": "parley-test:planner-42",
      "sig": "iFmQeJE+So1X6ydaDBBxKxnXdCA5uB4GDR8sK4+jU273RrSFlACiLZ+tkjaH1VvmnmWT7CYRyfFvfGHpFSx9Aw=="
    }
  },
  {
    "v": 0,
    "from": {
      "id": "dispatcher-7"
    },
    "to": {
      "id": "planner-42"
    },
    "ts": "2026-10-25T20:56:45Z",
    "act": "propose",
    "target": "route.plan",
    "parent": "msg:6ea1857e9ed5d770",
    "body": {
      "route": {
        "eta_min": 142,
        "stops": [
          "Lisboa",
          "Coimbra",
          "Viseu",
          "Porto"
        ]
      },
      "cost_eur": 1.4
    },
    "confidence": 0.93,
    "note": "Viseu has roadworks; the alternate route via Aveiro is +40 min",
    "tenant": "acme",
    "id": "msg:43487a2529071275",
    "signature": {
      "alg": "ed25519",
      "key": "parley-test:dispatcher-7",
      "sig": "eA5A6QQTh816g0wsRUzoWHGFLMFyPefsTkoSSNZZAaDgQ5Ex+9AF7Lkl8ZcQcytmmfG6PVOogXdqYCrOAp0lDQ=="
    }
  },
  {
    "v": 0,
    "from": {
      "id": "planner-42"
    },
    "to": {
      "id": "dispatcher-7"
    },
    "ts": "2026-10-25T20:56:45Z",
    "act": "accept",
    "target": "route.plan",
    "clauses": [
      "c3"
    ],
    "provenance": [
      "msg:6ea1857e9ed5d770",
      "msg:43487a2529071275"
    ],
    "tenant": "acme",
    "id": "msg:a38ef40248ce87a4",
    "signature": {
      "alg": "ed25519",
      "key": "parley-test:planner-42",
      "sig": "qE6I8NiTYU53vkWQWTlXOjB9og54LyovQqFQUCW7gOn/3T3XsR8ipFGtifTTxoM+w4FjmNkZuIDBlV2JlvM4Bw=="
    }
  }
]
